rule_id,input_condition,decision_without_vital,what_counts_as_actionable,why_this_is_a_realistic_baseline
B1_LABEL_DRIVEN_BASELINE,A variant is exported as public ClinVar P/LP.,ROUTE_PLP_ACTIONABLE,Downstream systems may treat the label as eligible for direct actionability unless additional context is explicitly encoded.,"Formalizes label-driven reuse as the null model being audited, not as a recommended clinical practice."
B2_ACTIONABILITY_CONTEXT_BASELINE,"Public P/LP appears in a gene linked to intervention, surveillance, cascade testing, device consideration, or therapy selection.",ROUTE_PLP_ACTIONABLE,The baseline route is direct-actionable in the relevant workflow context.,"Captures the practical actionability proxy created when condition, inheritance, and evaluability fields are flattened."
B3_NO_IMPLIED_BENIGNITY,A public P/LP variant does not remain VITAL_OK after constraint routing.,NO_BENIGNITY_INFERENCE,"Absence of VITAL_OK does not imply benignity, incorrectness, or clinical irrelevance.",Separates pathogenicity classification from actionability routing.
B4_CONTROL_NO_ACTION,"ClinVar classification in {Benign, Likely benign}",ROUTE_NO_ACTION,No positive disease-action escalation.,Used for the B/LB control layer.
B5_CONTEXT_INSUFFICIENT_REVIEW,Any non-P/LP or context-insufficient record outside the defined reuse environments,ROUTE_REVIEW,No direct action; manual review required.,Completes the formal decision model even though the main arrhythmia cohort is P/LP-enriched.
